program_normalized_name	course_suffix	offerings_count
BACHELOR OF SCIENCE IN MECHANICAL AND MANUFACTURING ENGINEERING	212	1
BACHELOR OF SCIENCE IN MECHATRONIC ENGINEERING	240	3
BACHELOR OF SCIENCE IN MICROBIOLOGY	279	1
BACHELOR OF SCIENCE IN MIDWIFERY WITH REPRODUCTIVE HEALTH	631	1
BACHELOR OF SCIENCE IN MOLECULAR BIOLOGY AND FORENSIC TECHNOLOGY	439	1
BACHELOR OF SCIENCE IN NETWORKS AND COMMUNICATION SYSTEMS	471	1
BACHELOR OF SCIENCE IN NUTRITION AND DIETETICS	202	5
BACHELOR OF SCIENCE IN ORAL HEALTH	218	1
BACHELOR OF SCIENCE IN PARKS, RECREATION AND LEISURE MANAGEMENT	341	1
BACHELOR OF SCIENCE IN PROCUREMENT AND CONTRACT MANAGEMENT	245	1
BACHELOR OF SCIENCE IN RANGELAND ECOSYSTEM MANAGEMENT	167	1
BACHELOR OF SCIENCE IN REAL ESTATE MANAGEMENT	683	1
BACHELOR OF SCIENCE IN RENEWABLE ENERGY AND TECHNOLOGY	627	3
BACHELOR OF SCIENCE IN SOFTWARE ENGINEERING	542	8
BACHELOR OF SCIENCE IN SOIL ENVIRONMENT & LAND USE MANAGEMENT)	765	1
BACHELOR OF SCIENCE IN STATISTICS & COMPUTER SCIENCE	856	1
BACHELOR OF SCIENCE IN STATISTICS AND PROGRAMMING	163	1
BACHELOR OF SCIENCE IN STATISTICS AND PROGRAMMING	664	1
BACHELOR OF SCIENCE IN TELECOMMUNICATION	707	2
BACHELOR OF SCIENCE IN TRAVEL AND TOURISM MANAGEMENT	684	3
BACHELOR OF SCIENCE INDUSTRIAL BIOTECHNOLOGY	728	1
BACHELOR OF SCIENCE WITH EDUCATION	418	3
BACHELOR OF SCIENCE(AEROSPACE ENGINEERING)	573	2
BACHELOR OF SCIENCE(BUSINESS INFORMATION SYSTEMS)	554	1
BACHELOR OF SCIENCE(CONSTRUCTION MANAGEMENT)	776	2
BACHELOR OF SCIENCE(FOOD SECURITY)	483	1
BACHELOR OF SECRETARIAL MANAGEMENT AND ADMINISTRATION	152	1
BACHELOR OF SECURITY SCIENCE AND MANAGEMENT	668	1
BACHELOR OF SOCIAL WORK	145	3
BACHELOR OF SOCIAL WORK AND ADMINISTRATION	685	2
BACHELOR OF SPORTS MANAGEMENT	435	2
BACHELOR OF TECHNOLOGY (APPLIED BIOLOGY)	474	1
BACHELOR OF TECHNOLOGY (APPLIED STATISTICS)	475	1
BACHELOR OF TECHNOLOGY (BIOTECHNOLOGY)	227	1
BACHELOR OF TECHNOLOGY (BUILDING CONSTRUCTION)	376	4
BACHELOR OF TECHNOLOGY (BUSINESS INFORMATION TECHNOLOGY)	384	1
BACHELOR OF TECHNOLOGY (CHEMICAL ENGINEERING)	699	1
BACHELOR OF TECHNOLOGY (CIVIL ENGINEERING TECHNOLOGY)	532	3
BACHELOR OF TECHNOLOGY (COMMUNICATION AND COMPUTER NETWORKS)	476	1
BACHELOR OF TECHNOLOGY (COMPUTER TECHNOLOGY)	266	1
BACHELOR OF TECHNOLOGY (CONSTRUCTION MANAGEMENT)	676	1
BACHELOR OF TECHNOLOGY (DESIGN)	372	1
BACHELOR OF TECHNOLOGY (ELECTRICAL AND ELECTRONIC ENGINEERING TECHNOLOGY)	527	4
BACHELOR OF TECHNOLOGY (ENVIRONMENTAL RESOURCE MANAGEMENT)	467	1
BACHELOR OF TECHNOLOGY (GEOINFORMATION TECHNOLOGY)	378	1
BACHELOR OF TECHNOLOGY (HOTEL AND RESTAURANT MANAGEMENT)	382	1
BACHELOR OF TECHNOLOGY (INDUSTRIAL AND APPLIED CHEMISTRY)	425	1
BACHELOR OF TECHNOLOGY (INSTITUTIONAL MANAGEMENT)	470	1
BACHELOR OF TECHNOLOGY (JOURNALISM AND MASS COMMUNICATION)	400	1
BACHELOR OF TECHNOLOGY (MECHANICAL ENGINEERING TECHNOLOGY)	535	5
BACHELOR OF TECHNOLOGY (MEDICAL LABORATORY SCIENCE)	194	1
BACHELOR OF TECHNOLOGY (MEDICAL LABORATORY SCIENCE)	383	1
BACHELOR OF TECHNOLOGY (NUTRITION AND DIETETICS)	381	1
BACHELOR OF TECHNOLOGY (OFFICE ADMINISTRATION AND TECHNOLOGY)	468	1
BACHELOR OF TECHNOLOGY (PRINTING TECHNOLOGY)	277	1
BACHELOR OF TECHNOLOGY (TECHNICAL AND APPLIED PHYSICS)	424	2
BACHELOR OF TECHNOLOGY (TELECOMMUNICATION AND INFORMATION ENGINEERING)	289	1
BACHELOR OF TECHNOLOGY EDUCATION	192	2
BACHELOR OF TECHNOLOGY IN APPLIED CHEMISTRY (ANALYTICAL AND INDUSTRIAL OPTIONS)	426	1
BACHELOR OF TECHNOLOGY IN APPLIED PHYSICS (ELECTRONICS & INSTRUMENTATION)	376	1
BACHELOR OF TECHNOLOGY IN COMPUTER AND ELECTRONIC SYSTEMS	220	1
BACHELOR OF TECHNOLOGY IN COSMETOLOGY AND BEAUTY SCIENCE	274	1
BACHELOR OF TECHNOLOGY IN ELECTRICAL AND COMPUTER ENGINEERING	978	1
BACHELOR OF TECHNOLOGY IN HOSPITALITY MANAGEMENT	225	1
BACHELOR OF TECHNOLOGY IN INDUSTRIAL MICROBIOLOGY & BIOTECHNOLOGY	280	1
BACHELOR OF TECHNOLOGY IN INSTRUMENTATION & CONTROL ENGINEERING	927	1
BACHELOR OF TECHNOLOGY IN MARINE ENGINEERING	537	1
BACHELOR OF TECHNOLOGY IN MECHANICAL VENTILATION AND AIR CONDITIONING	139	1
BACHELOR OF TECHNOLOGY IN MEDICAL ENGINEERING	534	2
BACHELOR OF TECHNOLOGY IN RENEWABLE ENERGY	981	1
BACHELOR OF TECHNOLOGY IN RENEWABLE ENERGY & ENVIRONMENTAL PHYSICS	380	1
BACHELOR OF TECHNOLOGY IN WATER, IRRIGATION AND ENVIRONMENTAL ENGINEERING	173	1
BACHELOR OF TECHNOLOGY IN WATER, SANITATION AND HABITAT ENGINEERING	919	1
BACHELOR OF THE BUILT ENVIRONMENT (URBAN AND REGIONAL PLANNING)	472	1
BACHELOR OF TRAVEL & TOURS OPERATIONS MANAGEMENT	234	4
BACHELOR OF URBAN AND REGIONAL PLANNING	340	1
BACHELOR OF VETERINARY MEDICINE	130	2
